{
  "$schema": "http://json-schema.org/draft-07/schema#",
  "describes": "Base schema of catalog entries",
  "type": "object",
  "properties": {
    "id": {
      "type": "string",
      "describes": "Unique identifier of the data resource within this domain"
    },
    "itemDescription": {
      "type": "string",
      "describes": "Text description of this item."
    },
    "refDataModel": {
      "type": "string",
      "format": "uri",
      "describes": "Reference to the data model for this catalog item. It is assumed that the referred to data-model(schema) has already been uploaded into the catalog OR stored in a pre-defined repository. The catalogue item comprises of fields from the refDataModel along with the refBaseSchema."
    },
    "refBaseSchema": {
      "type": "string",
      "format": "uri",
      "describes": "Reference to the IUDX base schema for this catalog item. It is assumed that the referred base schema has already been uploaded into the catalog OR stored in a pre-defined repository. The catalogue item comprises of fields from the refDataModel along with the refBaseSchema."
    },
    "refBaseSchemaRelease": {
      "type": "string",
      "describes": "Release number/label associated with the IUDX base schema (refBaseSchema) used for this item."
    },
    "provider": {
      "$ref": "https://raw.githubusercontent.com/rbccps-iisc/iudx-schemas/master/base_schemas/v0.0.1/iudx_base_def.json#/definitions/refToProviderItemSchema"
    },
    "tags": {
      "$ref": "https://raw.githubusercontent.com/rbccps-iisc/iudx-schemas/master/base_schemas/v0.0.1/iudx_base_def.json#/definitions/tagsSchema"
    },
    "__itemStatus": {
      "$ref": "https://raw.githubusercontent.com/rbccps-iisc/iudx-schemas/master/base_schemas/v0.0.1/iudx_base_def.json#/definitions/itemStatusSchema"
    },
    "__itemType": {
      "$ref": "https://raw.githubusercontent.com/rbccps-iisc/iudx-schemas/master/base_schemas/v0.0.1/iudx_base_def.json#/definitions/itemTypeSchema"
    },
    "__createdAt": {
       "type": "string",
       "format": "date-time",
       "describes": "Date of creation of this entry in the catalogue."
    },
    "__updatedAt": {
       "type": "string",
       "format": "date-time",
       "describes": "Last update date/time for this entry in the catalogue."
    },
    "__deprecatedAt": {
       "type": "string",
       "format": "date-time",
       "describes": "Date/time when this entry was deprecated (status set to deprecated)."
    },
    "__catalogueInstanceId": {
       "type": "string",
       "describes": "Registered Id of the IUDX-catalouge instance to which this item belongs."
    }
  },
  "additionalProperties": {
    "type": ["number", "integer", "null", "string", "object", "boolean", "array"]
  },
  "required": ["id", "refDataModel", "refBaseSchema", "provider", "tags"]
}
